{
  "version": "1.0.0",
  "generated": "2026-01-02T02:30:00Z",
  "description": "Router manifest generated from introspecting installed agents and skills",
  "source": "generate-router-manifest command",

  "agent_categories": {
    "product_documentation": {
      "description": "PRD, TRD, documentation, and requirements management",
      "triggers": [
        "PRD", "TRD", "product requirements", "technical requirements",
        "documentation", "docs", "requirements", "spec", "specification",
        "API docs", "swagger", "openapi", "user story", "stakeholder",
        "roadmap", "feature prioritization"
      ],
      "agents": [
        {
          "name": "product-management-orchestrator",
          "purpose": "Product lifecycle, requirements gathering, stakeholder alignment, roadmap planning",
          "tools": ["Read", "Write", "Edit", "Bash", "Task", "TodoWrite", "Grep", "Glob", "AskUserQuestion"]
        },
        {
          "name": "documentation-specialist",
          "purpose": "Technical documentation, API docs, guides, and examples",
          "tools": ["Read", "Write", "Edit", "Bash"]
        },
        {
          "name": "api-documentation-specialist",
          "purpose": "OpenAPI/Swagger documentation and API design",
          "tools": ["Read", "Write", "Edit", "Grep", "Glob", "Bash", "Task"]
        }
      ]
    },

    "orchestration": {
      "description": "High-level coordination, planning, and task decomposition",
      "triggers": [
        "orchestrate", "coordinate", "plan", "break down", "decompose",
        "architect", "design system", "full pipeline", "end to end",
        "delegate", "multi-step", "complex task", "methodology",
        "sprint", "scrum", "kanban", "backlog", "retrospective",
        "standup", "sprint planning", "refinement",
        "user story", "epic", "story points", "velocity",
        "estimate", "timeline", "milestone", "deadline", "priority",
        "dependency", "blocker", "critical path", "risk"
      ],
      "agents": [
        {
          "name": "ensemble-orchestrator",
          "purpose": "Chief orchestrator for agent mesh coordination, task delegation, conflict resolution",
          "tools": ["Read", "Task", "Write", "Edit", "Bash", "Grep", "Glob", "TodoWrite", "AskUserQuestion"]
        },
        {
          "name": "tech-lead-orchestrator",
          "purpose": "Plan, architect, task breakdown, develop, code-review, test loop with intelligent delegation",
          "tools": ["Read", "Write", "TodoWrite", "Edit", "Bash", "Task", "Grep", "Glob", "AskUserQuestion"]
        },
        {
          "name": "qa-orchestrator",
          "purpose": "Quality assurance orchestration and test coordination",
          "tools": ["Read", "Write", "Edit", "Bash"]
        },
        {
          "name": "infrastructure-orchestrator",
          "purpose": "Infrastructure provisioning, configuration management, monitoring, scalability planning",
          "tools": ["Read", "Write", "Edit", "Bash"]
        }
      ]
    },

    "development": {
      "description": "Code implementation across languages and frameworks",
      "triggers": [
        "implement", "code", "build", "create feature", "add feature",
        "frontend", "backend", "mobile", "component", "endpoint", "API",
        "react", "vue", "angular", "svelte", "node", "python", "ruby",
        "elixir", "flutter", "iOS", "android", "typescript", "javascript",
        "server-side", "client-side", "UI", "UX",
        "refactor", "optimize", "migrate", "upgrade", "scaffold",
        "modernize", "rewrite", "port", "convert", "generate",
        "microservice", "monolith", "serverless", "BFF", "gateway",
        "event-driven", "CQRS", "DDD", "clean architecture",
        "nuxt", "remix", "astro", "qwik", "hono",
        "golang", "go", "rust", "kotlin", "swift", "java", "csharp",
        "php", "laravel", "django", "fastapi",
        "tailwind", "css", "scss", "styled-components",
        "redux", "zustand", "pinia", "mobx", "signals",
        "graphql", "apollo", "rest", "grpc", "websocket"
      ],
      "agents": [
        {
          "name": "frontend-developer",
          "purpose": "JS/TS, React, Vue, Angular, Svelte with accessibility and performance optimization",
          "tools": ["Read", "Write", "Edit", "Grep", "Glob", "Bash", "Task"]
        },
        {
          "name": "backend-developer",
          "purpose": "Server-side logic across languages/stacks, clean architecture and boundaries",
          "tools": ["Read", "Write", "Edit", "Bash", "Grep", "Glob"]
        },
        {
          "name": "mobile-developer",
          "purpose": "Flutter, React Native, native iOS/Android with platform-specific UI patterns",
          "tools": ["Read", "Write", "Edit", "Grep", "Glob", "Bash", "Task"]
        },
        {
          "name": "infrastructure-developer",
          "purpose": "Cloud-agnostic automation: AWS, GCP, Azure, Helm, Kubernetes, Fly.io",
          "tools": ["Read", "Write", "Edit", "Grep", "Glob", "Bash", "Task"]
        }
      ]
    },

    "quality_testing": {
      "description": "Code review, testing, debugging, and quality assurance",
      "triggers": [
        "review", "test", "debug", "fix bug", "why is this failing",
        "unit test", "integration test", "e2e test", "playwright",
        "code review", "security", "performance", "coverage", "lint",
        "failing", "error", "exception", "broken", "investigate",
        "smoke test", "regression test", "load test", "stress test",
        "acceptance test", "contract test", "snapshot test", "visual test",
        "mock", "stub", "spy", "fixture", "factory", "faker",
        "test double", "arrange act assert", "given when then",
        "coverage report", "uncovered", "branch coverage", "line coverage",
        "missing test", "untested", "dead code",
        "code smell", "technical debt", "complexity", "sonarqube"
      ],
      "agents": [
        {
          "name": "code-reviewer",
          "purpose": "Security-enhanced code review with comprehensive DoD enforcement and quality gates",
          "tools": ["Read", "Write", "Edit", "Bash", "Grep"]
        },
        {
          "name": "test-runner",
          "purpose": "Unit and integration test execution with intelligent failure triage and debugging",
          "tools": ["Read", "Bash", "Grep"]
        },
        {
          "name": "deep-debugger",
          "purpose": "Systematic bug recreation, root cause analysis, TDD-based resolution",
          "tools": ["Read", "Write", "TodoWrite", "Edit", "Bash", "Task", "Grep", "Glob", "Skill"]
        },
        {
          "name": "playwright-tester",
          "purpose": "E2E tests with Playwright MCP, capture traces and screenshots for regression",
          "tools": ["Read", "Write", "Edit", "Bash"]
        },
        {
          "name": "test-reader-agent",
          "purpose": "Test file reading and analysis for test coverage understanding",
          "tools": ["Read"]
        }
      ]
    },

    "infrastructure_build": {
      "description": "Deployment, CI/CD, releases, and build systems",
      "triggers": [
        "deploy", "release", "CI/CD", "pipeline", "docker", "kubernetes",
        "helm", "staging", "production", "rollback", "build", "artifact",
        "promote", "zero-downtime", "container", "orchestration",
        "AWS", "GCP", "Azure", "DigitalOcean",
        "EC2", "ECS", "EKS", "Fargate", "GKE", "AKS",
        "Lambda", "Cloud Functions", "serverless function",
        "pod", "container image", "registry", "ECR",
        "DNS", "SSL", "TLS", "certificate", "HTTPS", "CORS",
        "load balancer", "ALB", "nginx", "traefik", "caddy",
        "proxy", "reverse proxy", "API gateway", "ingress",
        "VPC", "subnet", "security group", "firewall",
        "terraform", "pulumi", "ansible", "cloudformation",
        "infrastructure as code", "IaC", "GitOps", "ArgoCD"
      ],
      "agents": [
        {
          "name": "deployment-orchestrator",
          "purpose": "Release automation, environment promotion, rollback procedures, zero-downtime deployment",
          "tools": ["Read", "Write", "Edit", "Bash"]
        },
        {
          "name": "build-orchestrator",
          "purpose": "CI/CD pipeline optimization, artifact creation, dependency management, build automation",
          "tools": ["Read", "Write", "Edit", "Bash"]
        },
        {
          "name": "release-agent",
          "purpose": "Automated release orchestration with quality gates, smoke test integration",
          "tools": ["Read", "Write", "Edit", "Bash", "Task", "Skill"]
        },
        {
          "name": "helm-chart-specialist",
          "purpose": "Kubernetes Helm charts (delegates to infrastructure-developer)",
          "tools": ["Read", "Task"]
        }
      ]
    },

    "git_github": {
      "description": "Version control, commits, branches, and pull requests",
      "triggers": [
        "commit", "push", "pull request", "PR", "branch", "merge",
        "git", "github", "conventional commit", "semantic version",
        "rebase", "cherry-pick", "stash", "diff", "blame",
        "squash", "bisect", "worktree", "reflog",
        "interactive rebase", "fixup", "autosquash", "amend",
        "hotfix", "feature branch", "release branch", "trunk based",
        "gitflow", "github flow", "forking workflow",
        "github actions", "workflow", "action runner",
        "issue", "milestone", "label", "project board",
        "approve PR", "request changes", "CODEOWNERS", "protected branch",
        "status check", "draft PR"
      ],
      "agents": [
        {
          "name": "git-workflow",
          "purpose": "Conventional commits, semantic versioning, git-town integration, best practices",
          "tools": ["Read", "Bash", "Grep"]
        },
        {
          "name": "github-specialist",